question,option1,option2,option3,option4,answer,imageName,underline,explanation_ko,explanation_en,explanation_zh_hans,explanation_zh_hant,explanation_ja,explanation_fr,explanation_id,explanation_es,explanation_th,explanation_vi,passage_group,sub_question
次の（１）から（４）の文章を読んで、後の問いに対する答えとして最もよいものを、１・２・３・４から一つ選びなさい。,緑があることで、街全体が脈やかに感じられること,緑を求めて集まることで、住民のつながりが強まること,木々の壁があることで、街が一つに整った状態になること,自然の壁がその色を変えることで、季節の変化を楽しめること,木々の壁があることで、街が一つに整った状態になること,,,지문에서는 나무로 된 부드럽고 연속적인 '벽'이 무질서한 거리를 통일하고 부드럽게 연결하는 데 성공한다고 말합니다. 따라서 나무는 마을을 하나의 통합된 전체처럼 보이게 합니다.,"The passage says the soft, continuous ‘walls’ of trees help unify disordered streets and succeed in gently connecting them. Thus, trees make the town look like one integrated whole.",文章称树木柔软连续的“墙”有助于统一混乱的街道并成功地连接它们。因此，树木使小镇看起来像一个整合的整体。,文章稱樹木柔軟連續的「牆」有助於統一混亂的街道並成功地連接它們。因此，樹木使小鎮看起來像一個整合的整體。,本文では、木々による柔らかく連続的な「壁」が無秩序な街並みを統一し、それらを緩やかに繋ぐことに成功していると述べています。したがって、木々は町を一つの統合された全体のように見せます。,"Le texte indique que les « murs » souples et continus formés par les arbres permettent d'unifier des rues désordonnées et de les relier en douceur. Ainsi, les arbres donnent à la ville l'apparence d'un tout intégré.","Teks tersebut menyatakan bahwa 'dinding' pohon yang lembut dan berkelanjutan membantu menyatukan jalan-jalan yang tidak beraturan dan berhasil menghubungkannya dengan lembut. Dengan demikian, pepohonan membuat kota terlihat seperti satu kesatuan yang utuh.","El texto dice que los ""muros"" suaves y continuos de árboles ayudan a unificar las calles desordenadas y logran conectarlas suavemente. Por lo tanto, los árboles hacen que la ciudad se vea como un todo integrado.",บทความระบุว่า 'กำแพง' ต้นไม้ที่อ่อนนุ่มและต่อเนื่องช่วยหลอมรวมถนนที่ไร้ระเบียบและประสบความสำเร็จในการเชื่อมต่อกันอย่างนุ่มนวล ดังนั้นต้นไม้จึงทำให้เมืองดูเหมือนเป็นหนึ่งเดียวกัน,"Bài đọc nói rằng những 'bức tường' cây cối mềm mại và liên tục giúp thống nhất những con phố lộn xộn và kết nối chúng một cách nhẹ nhàng. Do đó, cây cối làm cho thị trấn trông như một tổng thể thống nhất.",P8,筆者は、並木の効果は何だと述べているか。\n\nわたしが幼児期から青年期までを過ごした半世紀前の「日本」は現在の「日本」から見れば「外国」である。あるいはわたしにとって今の「母国」はすでにどこかに消え去って、今わたしが暮らしている「外国暮らし」をしているのかもしれない。国名だけはかわっていない。「外国」で有り、そこに一つの「時代」は「外国」なのであるのは明らかに「異文化」なのである。
次の（１）から（４）の文章を読んで、後の問いに対する答えとして最もよいものを、１・２・３・４から一つ選びなさい。,「時代」が変わると文化がかわりに、自国も外国のように感じられる。,半世紀前より、外国の文化に接することが増えたように感じられる。,昔の文化が「時代」とともに消え去っていくのは、惜しいと感じられる。,外国で暮らしているのに、まるで半世紀前の母国にいるように感じられる。,「時代」が変わると文化がかわりに、自国も外国のように感じられる。,,,"저자는 자신의 젊은 시절(50년 전)의 일본이 오늘날의 관점에서 보면 '외국' 같다고 말합니다. 그는 각 시대가 '다른 문화'이며, 따라서 시간이 지남에 따라 고국도 낯설게 느껴질 수 있음을 암시합니다.","The author says the Japan of his youth (50 years ago) is, from today’s perspective, like a ‘foreign country.’ He implies each era is an ‘other culture,’ so one’s homeland can feel foreign as time passes.",作者认为他年轻时（50年前）的日本，从今天的角度看就像“外国”。他暗示每个时代都是一种“他文化”，因此随着时间的推移，家乡也会感到陌生。,作者認為他年輕時（50年前）的日本，從今天的角度看就像「外國」。他暗示每個時代都是一種「他文化」，因此隨著時間的推移，家鄉也會感到陌生。,筆者は、自身の若い頃（50年前）の日本が、今日の視点から見ると「外国」のようだと述べています。彼は各時代が「異文化」であると暗示しており、したがって時間が経つにつれて故郷もよそよそしく（見知らぬ場所に）感じられる可能性があるとしています。,"L'auteur déclare que le Japon de sa jeunesse (il y a 50 ans) ressemble à un « pays étranger » de son point de vue actuel. Il suggère que chaque époque est une « autre culture », et qu'avec le temps, son propre pays peut donc sembler étranger.","Penulis menyatakan bahwa Jepang pada masa mudanya (50 tahun lalu) dari sudut pandang saat ini seperti 'negara asing'. Ia mengisyaratkan bahwa setiap era adalah 'budaya lain', sehingga seiring berjalannya waktu, negara sendiri pun bisa terasa asing.","El autor dice que el Japón de su juventud (hace 50 años) es, desde la perspectiva actual, como un 'país extranjero'. Insinúa que cada época es 'otra cultura', por lo que el propio país puede sentirse extraño a medida que pasa el tiempo.",ผู้เขียนกล่าวว่าประเทศญี่ปุ่นในวัยหนุ่มของเขา (50 ปีก่อน) จากมุมมองปัจจุบันเป็นเหมือน 'ต่างประเทศ' เขาบอกเป็นนัยว่าแต่ละยุคสมัยคือ 'อีกวัฒนธรรมหนึ่ง' ดังนั้นเมื่อเวลาผ่านไป บ้านเกิดของตัวเองก็อาจรู้สึกแปลกตาได้,"Tác giả nói rằng nước Nhật thời trẻ của ông (50 năm trước) xét từ góc độ hiện tại giống như một 'nước ngoài'. Ông ngụ ý rằng mỗi thời đại là 'một nền văn hóa khác', do đó theo thời gian, quê hương của chính mình cũng có thể trở nên xa lạ.",P8,筆者の考えに合うのはどれか。\n\nわたしが幼児期から青年期までを過ごした半世紀前の「日本」は現在の「日本」から見れば「外国」である。あるいはわたしにとって今の「母国」はすでにどこかに消え去って、今わたしが暮らしている「外国暮らし」をしているのかもしれない。国名だけはかわっていない。「外国」で有り、そこに一つの「時代」は「外国」なのであるのは明らかに「異文化」なのである。
次の（１）から（４）の文章を読んで、後の問いに対する答えとして最もよいものを、１・２・３・４から一つ選びなさい。,買い手に買いたいとおもわせるようにする。,買い手の好む宣伝手法を取り入れる。,買い手の希望を聞いて具体的な形にする。,買い手より先に流行をつかむようにする。,買い手に買いたいとおもわせるようにする。,,,"지문에서는 프로모션이 '사실'이 아니라 사람들이 무언가를 인기 있거나 바람직하다고 생각하게 만드는 '인식 형성'에 중점을 둔다고 말합니다(""유행한다고 생각하게 만들면, 유행하게 된다""). 이를 ""꿈을 판다""고 부릅니다.","The passage states promotion focuses not on ‘facts’ but on *shaping recognition*—making people think something is popular/desirable (“if you make them think it’s trending, it will trend”). This is called “selling dreams.”",文章称，推广重点不在于“事实”，而在于“塑造认知”——让人认为某事是流行或值得的（“如果你让人觉得它正在流行，它就会流行”）。这被称为“兜售梦想”。,文章稱，推廣重點不在於「事實」，而在於「塑造認知」——讓人認為某事是流行或值得的（「如果你讓人覺得它正在流行，它就會流行」）。這被稱為「兜售夢想」。,本文では、プロモーションの焦点は「事実」ではなく「認識の形成」にあると述べています。つまり、人々に何かが人気がある、あるいは望ましいと考えさせること（「流行っていると思わせれば、流行る」）です。これは「夢を売る」と呼ばれています。,"Le texte affirme que la promotion ne se concentre pas sur les « faits », mais sur le « façonnement des perceptions » : faire croire aux gens que quelque chose est populaire ou désirable (« Si on leur fait croire que c'est à la mode, ça le deviendra »). C'est ce qu'on appelle « vendre du rêve ».","Teks menyatakan bahwa promosi tidak berfokus pada 'fakta', melainkan pada 'pembentukan persepsi'—membuat orang berpikir bahwa sesuatu itu populer/diinginkan (""jika Anda membuat mereka berpikir itu sedang tren, itu akan menjadi tren""). Ini disebut ""menjual impian"".","El texto indica que la promoción no se centra en los 'hechos', sino en 'moldear la percepción'—hacer que la gente piense que algo es popular/deseable (""si les haces creer que es tendencia, se convertirá en tendencia""). Esto se llama ""vender sueños"".","บทความระบุว่าการโปรโมตไม่ได้เน้นที่ 'ข้อเท็จจริง' แต่เป็นการ 'สร้างการรับรู้' — ทำให้ผู้คนคิดว่าสิ่งนั้นเป็นที่นิยม/เป็นที่ต้องการ (""ถ้าทำให้คิดว่ากำลังฮิต มันก็จะฮิต"") สิ่งนี้เรียกว่า ""การขายความฝัน""","Bài đọc chỉ ra rằng việc quảng bá không tập trung vào 'sự thật', mà là 'định hình nhận thức' — khiến mọi người nghĩ rằng điều gì đó đang phổ biến/được khao khát (""nếu bạn khiến họ nghĩ nó đang là xu hướng, nó sẽ thành xu hướng""). Điều này được gọi là ""bán ước mơ"".",P8,「夢を売る」とはどういうことか。\n\n（４）筆者がレコード会社の宣伝担当者から聞いた言葉に「流行っていると思わせれば、本当に流行る」というのがある。こうした宣伝の場面において音楽産業が力を注ぐのは「事実」ではなく「買い手にそう思わせること」、つまり「認識の形成」である。こうした手法を音楽業は「夢を売る」とよく呼ぶ。つまり音楽産業は買い手がほしがる「ファンタジー（注1）」を先んじて（注2）キャッチし、商品化し、売ることに長けている（注3）。（注1）ファンタジー：幻想（注2）先んじて：ここでは、誰よりも早く（注3）長けている：優れている
（１）近年、わが国では、物事を解説したり、考え方や視点を明確に伝えたりする際に、難解な言葉や文章を使うことは敬遠され、よりわかりやすい言葉や文章、語りが求められる傾向が顕著である。テレビの番組などでニュース解説を担当するキャスターの中には、そのわかりやすい解説で人気を博す（注1）者もある。わかりやすさは確かに重要であり、学校の授業でもよい授業、子供たちの効果のよい学習活動が展開される授業における指導者の言葉や解説は、わかりやすく的確である。さらに各種の映像装置を駆使するなど、わかりやすさを実現するための技術も進歩している。そこで、言葉が思考と伝達のための主たる役目を担うことになるが、そのわかりやすさはときとして、受け取る側の思考の多様性や広がり、深まりを妨害することがある。わかりにくいものとわかりやすいものがあれば、人は当然わかりやすい方を選択する。わかりやすく的確な言葉は、そのまま学習者の中に蓄えられる。そして、多くの人はその時点で学習が終了したと考えるのである。わからなかったことがわかった、新しい知識を得た、これが学習の最終段階だと思ってしまうのである。しかしそれは、自身の中にその解説を発した人の言葉や考えを取り入れたにすぎない。「学びの真正性（注2）」とは、そこから自身の新たな思考を広げ、それらが表現される段階まで進むことである。そして、その多くは自分一人で行われるものではなく、他者との関係性の中で成立することが多い。（注1）博す：得る（注2）学びの真正性：ここでは、本物の学び,言葉だけでわかりやすく伝えることが求められている。,明確に伝えることができるようになっている。,わかりやすく解説できない物事は避けられている。,わかりやすく伝えることが重視されている。,わかりやすく伝えることが重視されている。,,,텍스트에서는 어려운 단어를 피하고 '더 이해하기 쉬운' 언어/표현을 향한 뚜렷한 추세가 있다고 말합니다. 따라서 이해하기 쉬움을 강조합니다.,The text says difficult words are avoided and there’s a clear trend toward *more easily understood* language/phrasing. Hence emphasis on ease of understanding.,文本称，避免使用生僻词汇，并且存在一种向“更容易理解”的语言/措辞发展的明显趋势。因此强调易理解性。,文本稱，避免使用生僻詞彙，並且存在一種向「更容易理解」的語言/措辭發展的明顯趨勢。因此強調易理解性。,文章では、難しい言葉は避けられ、「より理解しやすい」言葉や表現へと向かう明確な傾向があると述べています。したがって「理解しやすさ」が強調されています。,Le texte précise que les mots difficiles sont évités et qu'il y a une nette tendance vers un langage et des expressions « plus faciles à comprendre ». D'où l'accent mis sur la facilité de compréhension.,"Teks menyatakan bahwa kata-kata yang sulit dihindari dan ada tren yang jelas menuju bahasa/ungkapan yang 'lebih mudah dipahami'. Oleh karena itu, penekanan diletakkan pada kemudahan pemahaman.",El texto establece que se evitan las palabras difíciles y hay una clara tendencia hacia un lenguaje/expresión 'más fácil de entender'. De ahí el énfasis en la facilidad de comprensión.,ข้อความระบุว่ามีการหลีกเลี่ยงคำศัพท์ที่ยาก และมีแนวโน้มที่ชัดเจนที่จะใช้ภาษา/การแสดงออกที่ 'เข้าใจง่ายขึ้น' ดังนั้นจึงให้ความสำคัญกับความง่ายในการทำความเข้าใจ,"Văn bản nói rằng các từ khó bị lảng tránh và có một xu hướng rõ ràng hướng tới ngôn ngữ/cách diễn đạt 'dễ hiểu hơn'. Do đó, nhấn mạnh vào sự dễ hiểu.",P9,近年の物事や思考の伝達について、筆者はどのように述べているか。
（１）近年、わが国では、物事を解説したり、考え方や視点を明確に伝えたりする際に、難解な言葉や文章を使うことは敬遠され、よりわかりやすい言葉や文章、語りが求められる傾向が顕著である。テレビの番組などでニュース解説を担当するキャスターの中には、そのわかりやすい解説で人気を博す（注1）者もある。わかりやすさは確かに重要であり、学校の授業でもよい授業、子供たちの効果のよい学習活動が展開される授業における指導者の言葉や解説は、わかりやすく的確である。さらに各種の映像装置を駆使するなど、わかりやすさを実現するための技術も進歩している。そこで、言葉が思考と伝達のための主たる役目を担うことになるが、そのわかりやすさはときとして、受け取る側の思考の多様性や広がり、深まりを妨害することがある。わかりにくいものとわかりやすいものがあれば、人は当然わかりやすい方を選択する。わかりやすく的確な言葉は、そのまま学習者の中に蓄えられる。そして、多くの人はその時点で学習が終了したと考えるのである。わからなかったことがわかった、新しい知識を得た、これが学習の最終段階だと思ってしまうのである。しかしそれは、自身の中にその解説を発した人の言葉や考えを取り入れたにすぎない。「学びの真正性（注2）」とは、そこから自身の新たな思考を広げ、それらが表現される段階まで進むことである。そして、その多くは自分一人で行われるものではなく、他者との関係性の中で成立することが多い。（注1）博す：得る（注2）学びの真正性：ここでは、本物の学び,わかったと思い、それ以上考えようとしなくなるから,わかりにくいものを理解しようとしなくなるから,わかりやすい言葉だけでは表現できない知識があるから,わかりやすいものは選択されやすいが、知識として定着しないから,わかったと思い、それ以上考えようとしなくなるから,,受け取る側の思考の多様性や広がり、深まりを妨害することがある,"저자는 쉽고 정확한 설명은 그대로 저장되며, 많은 사람이 그 시점에서 학습이 끝났다고 여겨 더 이상의 독립적인 사고를 방해하고, 결과적으로 다양성/깊이를 저해한다고 설명합니다.","The author explains that easy, precise explanations get stored as-is, and many consider learning finished at that point, preventing further independent thought—thus hindering diversity/depth.",作者解释说，简单精确的解释会被原样存储，许多人认为到此为止学习就结束了，这阻碍了进一步的独立思考，从而阻碍了多样性/深度。,作者解釋說，簡單精確的解釋會被原樣存儲，許多人認為到此為止學習就結束了，這阻礙了進一步的獨立思考，從而阻礙了多樣性/深度。,筆者は、簡単で正確な説明はそのまま記憶され、多くの人がその時点で学習が終わったと考えてしまい、それ以上の主体的な思考が妨げられ、結果として多様性や深みが損なわれると説明しています。,"L'auteur explique que les explications simples et précises sont mémorisées telles quelles, et beaucoup considèrent que l'apprentissage s'arrête là, ce qui entrave toute réflexion indépendante ultérieure et nuit à la diversité et à la profondeur.","Penulis menjelaskan bahwa penjelasan yang mudah dan tepat akan disimpan apa adanya, dan banyak orang menganggap pembelajaran selesai sampai di situ, yang mana menghalangi pemikiran mandiri lebih lanjut, sehingga menghambat keragaman/kedalaman.","El autor explica que las explicaciones fáciles y precisas se almacenan tal cual, y muchos consideran que el aprendizaje termina ahí, lo que impide un mayor pensamiento independiente y, en consecuencia, frena la diversidad/profundidad.",ผู้เขียนอธิบายว่าคำอธิบายที่ง่ายและแม่นยำจะถูกจดจำตามสภาพเดิม และหลายคนมองว่าการเรียนรู้สิ้นสุดลงแค่นั้น ซึ่งเป็นการขัดขวางการคิดอย่างอิสระในขั้นต่อไป ส่งผลให้ความหลากหลาย/ความลึกซึ้งลดลง,"Tác giả giải thích rằng những lời giải thích dễ dàng và chính xác được lưu giữ y nguyên, và nhiều người coi việc học kết thúc ở đó, điều này cản trở tư duy độc lập xa hơn, từ đó cản trở sự đa dạng/chiều sâu.",P9,受け取る側の思考の多様性や広がり、深まりを妨害することがある。とあるが、なぜか。
