question,option1,option2,option3,option4,answer,audioFileName,startTime,endTime,imageName,scriptKey,script_ko,script_en,script_zh_hans,script_zh_hant,script_ja,script_fr,script_id,script_es,script_th,script_vi
1番,前日までに郵便で,前日までに劇場の窓口で,当日、劇場の券売機で,当日、劇場の窓口で,当日、劇場の券売機で,n1q46.m4a,105,183,,,"1번 내레이터: 1번. 남자가 전화로 연극 티켓을 예약했습니다. 남자는 티켓을 어떻게 수령합니까? 여: 네, 확실히 예약 접수했습니다. 그럼 티켓 수령 방법에 대해 설명해 드리겠습니다. 남: 네. 여: 공연일까지 8일 이상 남은 경우는 우편으로 보내드리고 있습니다만, 이미 6일 전이므로 당일 극장에 오셨을 때 창구 옆에 설치된 발권기에서 수령해 주십시오. 그때 예약 번호가 필요합니다. 남: 아, 고객님의 예약 번호는 134번이오니 메모해 두십시오. 남: 저기, 당일은 혼잡하겠죠. 전날까지 찾으러 가도 될까요? 여: 죄송합니다. 예약하신 티켓의 발행은 당일에만 가능하도록 되어 있습니다. 남: 그렇군요. 내레이터: 남자는 티켓을 어떻게 수령합니까?","Narrator: No. 1. A man is reserving a theater ticket on the phone. How will the man receive the ticket? Woman: Yes, we have certainly received your reservation. Now, I will explain how to receive your ticket. Man: Yes. Woman: If there are 8 or more days until the performance date, we mail it to you, but since it is already 6 days before, please pick it up at the ticket machine installed next to the ticket window when you come to the theater on the day of the performance. You will need your reservation number at that time. Man: Ah, your reservation number is 134, so please make a note of it. Man: Um, it will be crowded on that day, right? Can I go pick it up by the day before? Woman: We are very sorry. The issued reserved ticket can only be printed on that specific day. Man: I see. Narrator: How will the man receive the ticket?",旁白：1号。男人正在通过电话预订戏剧门票。男人将如何领取门票？ 女：好的，您的预订已确认。那么，我来为您说明一下领取门票的方法。 男：好的。 女：如果距离演出日还有8天以上，我们会为您邮寄，但因为现在距离演出只剩6天，所以请您在演出当天来到剧场时，在窗口旁边的自动售票机上领取。届时将需要您的预订编号。 男：哦，您的预订编号是134，请您记下来。 男：那个，当天人会很多吧。可以在前一天之前去拿吗？ 女：非常抱歉。您预订的门票规定只能在当天发行。 男：这样啊。 旁白：男人将如何领取门票？,旁白：1號。男人正在透過電話預訂戲劇門票。男人將如何領取門票？ 女：好的，您的預訂已確認。那麼，我來為您說明一下領取門票的方法。 男：好的。 女：如果距離演出日還有8天以上，我們會為您郵寄，但因為現在距離演出只剩6天，所以請您在演出當天來到劇場時，在窗口旁邊的自動售票機上領取。屆時將需要您的預訂編號。 男：哦，您的預訂編號是134，請您記下來。 男：那個，當天人會很多吧。可以在前一天之前去拿嗎？ 女：非常抱歉。您預訂的門票規定只能在當天發行。 男：這樣啊。 旁白：男人將如何領取門票？,1番 ナレーター：1番。男の人が電話で演劇のチケットを予約しました。男の人はチケットをどのように受け取りますか。  女：はい、確かにご予約承りました。では、チケットのお受け取り方法についてご説明いたします。 男：はい。 女：公演日まで8日以上ある場合は、ご郵送させていただいておりますが、すでに6日前となっておりますので、当日、劇場にお越しいただいた際に、窓口横に設置されている券売機でお受け取りください。その際、予約番号が必要になります。 男：おー、お客様の予約番号は134ですので、お控えください。 男：あのう、当日は込みますよね。前日までに取りに行ってもいいですか？ 女：申し訳ございません。予約されたチケットの発行は、その日でないとできないことになっているんです。 男：そうですか。  ナレーター：男の人はチケットをどのように受け取りますか。,"Narrateur : Numéro 1. Un homme réserve un billet de théâtre par téléphone. Comment l'homme va-t-il récupérer le billet ? Femme : Oui, nous avons bien reçu votre réservation. Je vais maintenant vous expliquer comment récupérer votre billet. Homme : Oui. Femme : S'il reste 8 jours ou plus avant la date de la représentation, nous vous l'envoyons par la poste. Mais comme nous sommes déjà à 6 jours de la date, veuillez le retirer à la borne automatique installée à côté du guichet lorsque vous viendrez au théâtre le jour même. Vous aurez besoin de votre numéro de réservation à ce moment-là. Homme : Ah, votre numéro de réservation est le 134, veuillez le noter. Homme : Euh, il y aura du monde ce jour-là, n'est-ce pas ? Puis-je passer le prendre la veille ? Femme : Nous sommes désolés. Les billets réservés ne peuvent être émis que le jour de la représentation. Homme : Je vois. Narrateur : Comment l'homme va-t-il récupérer le billet ?","Narator: Nomor 1. Seorang pria memesan tiket teater melalui telepon. Bagaimana pria itu akan menerima tiketnya? Wanita: Ya, kami telah menerima pesanan Anda. Sekarang, saya akan menjelaskan cara menerima tiket Anda. Pria: Ya. Wanita: Jika ada 8 hari atau lebih sebelum tanggal pertunjukan, kami akan mengirimkannya melalui pos, tetapi karena ini sudah 6 hari sebelumnya, silakan ambil di mesin tiket yang dipasang di sebelah loket saat Anda datang ke teater pada hari pertunjukan. Anda akan memerlukan nomor pesanan Anda pada saat itu. Pria: Ah, nomor pesanan Anda adalah 134, jadi mohon dicatat. Pria: Permisi, hari itu pasti ramai, kan. Bolehkah saya mengambilnya sehari sebelumnya? Wanita: Mohon maaf. Tiket yang dipesan hanya dapat dicetak pada hari pertunjukan tersebut. Pria: Begitu ya. Narator: Bagaimana pria itu akan menerima tiketnya?","Narrador: Número 1. Un hombre está reservando una entrada de teatro por teléfono. ¿Cómo recibirá el hombre la entrada? Mujer: Sí, hemos recibido su reserva. Ahora le explicaré cómo recibir su entrada. Hombre: Sí. Mujer: Si faltan 8 días o más para la fecha de la función, se la enviamos por correo, pero como ya estamos a 6 días, recójala en la máquina expendedora de entradas instalada junto a la taquilla cuando venga al teatro el día de la función. En ese momento necesitará su número de reserva. Hombre: Ah, su número de reserva es el 134, por favor anótelo. Hombre: Esto, ese día habrá mucha gente, ¿verdad? ¿Puedo ir a recogerla el día anterior? Mujer: Lo sentimos mucho. La entrada reservada solo se puede emitir ese mismo día. Hombre: Ya veo. Narrador: ¿Cómo recibirá el hombre la entrada?",ผู้บรรยาย: ข้อ 1 ผู้ชายกำลังจองตั๋วละครเวทีทางโทรศัพท์ ผู้ชายจะรับตั๋วอย่างไร? หญิง: ค่ะ ทางเราได้รับการจองของคุณเรียบร้อยแล้ว ต่อไปจะขออธิบายวิธีการรับตั๋วนะคะ ชาย: ครับ หญิง: กรณีที่เหลือเวลาอีก 8 วันขึ้นไปก่อนถึงวันแสดง ทางเราจะจัดส่งทางไปรษณีย์ค่ะ แต่เนื่องจากตอนนี้เหลือเวลาอีก 6 วัน ดังนั้นในวันแสดงเมื่อคุณมาถึงโรงละคร กรุณารับตั๋วที่ตู้จำหน่ายตั๋วอัตโนมัติซึ่งติดตั้งอยู่ข้างช่องจำหน่ายตั๋วค่ะ ในตอนนั้นจำเป็นต้องใช้หมายเลขการจองด้วยค่ะ ชาย: อ้อ หมายเลขการจองของลูกค้าคือ 134 กรุณาจดไว้ด้วยนะครับ ชาย: เอ้อ วันนั้นคนน่าจะเยอะใช่ไหมครับ ผมไปรับล่วงหน้าก่อนหนึ่งวันได้ไหมครับ? หญิง: ต้องขออภัยด้วยค่ะ ตั๋วที่จองไว้จะสามารถพิมพ์ออกให้ได้เฉพาะในวันนั้นเท่านั้นค่ะ ชาย: อย่างนั้นหรือครับ ผู้บรรยาย: ผู้ชายจะรับตั๋วอย่างไร?,"Người dẫn chuyện: Câu 1. Một người đàn ông đang gọi điện thoại đặt vé xem kịch. Người đàn ông sẽ nhận vé bằng cách nào? Nữ: Vâng, chúng tôi đã nhận được thông tin đặt vé của quý khách. Sau đây, tôi xin giải thích về cách thức nhận vé. Nam: Vâng. Nữ: Nếu còn từ 8 ngày trở lên mới đến ngày diễn, chúng tôi sẽ gửi vé qua đường bưu điện, nhưng vì hiện tại chỉ còn 6 ngày, nên khi đến nhà hát vào ngày diễn, quý khách vui lòng nhận vé tại máy bán vé tự động đặt cạnh quầy vé. Khi đó, quý khách sẽ cần mã số đặt vé. Nam: À, mã số đặt vé của quý khách là 134, vui lòng ghi chú lại nhé. Nam: À này, ngày hôm đó chắc sẽ đông lắm nhỉ. Tôi đến lấy vé trước một ngày có được không? Nữ: Thành thật xin lỗi quý khách. Theo quy định, vé đã đặt chỉ có thể được xuất ra vào đúng ngày diễn. Nam: Vậy à. Người dẫn chuyện: Người đàn ông sẽ nhận vé bằng cách nào?"
