question,option1,option2,option3,option4,answer,imageName,underline,explanation_ko,explanation_en,explanation_zh_hans,explanation_zh_hant,explanation_ja,explanation_fr,explanation_id,explanation_es,explanation_th,explanation_vi,passage_group,sub_question 
（求人サイトの「よくある質問」で） Ｑ:インテリアに関する知識がないのですが、働けますか。 Ａ:研修があるので大丈夫です。知識はある（ ）が、それよりも人柄や仕事に取り組む姿勢を重視しています。,にすぎません,ことは否めません,に越したことはありません,といっても過言ではありません,に越したことはありません,,,『〜に越したことはない』=それが最善。知識はあるに越したことはない。,Best to have X: having knowledge is preferable.,『…に越したことはない』=最好有。,『…に越したことはない』=最好有。,『あるに越したことはない』が定型。,«〜に越したことはない» = il vaut mieux.,«〜に越したことはない» = sebaiknya ada.,«〜に越したことはない» = mejor tenerlo.,«〜に越したことはない» = มีไว้ก็ดีที่สุด,«〜に越したことはない» = có thì tốt nhất.,,
（お知らせで） 水道管破裂による断水のため、８月１ ２日まで市民プールの営業を休止します。復旧状況（ ） 、営業再開が遅れる可能性がありますので、ご了承ください。,次第には,次第に,次第では,次第,次第では,,,『〜次第では』=状況によっては。復旧状況次第では再開が遅れる。,Shidai de wa = depending on; reopening may be delayed.,『次第では』=视情况而定。可能延迟重开。,『次第では』=視情況而定。可能延後。,『復旧状況次第では』が自然。,«次第では» = selon les circonstances.,«次第では» = tergantung situasi.,«次第では» = según la situación.,«次第では» = ขึ้นอยู่กับสถานการณ์,«次第では» = tùy tình hình.,,
クレジットカードの番号等、他人に（ ）困る情報は、電子メールには書かないほうがいいそうだ。,知っていても,知っていなくても,知らなくては,知られては,知られては,,,『〜てはならない』のニュアンス。『知られては困る情報』=知られてはいけない。,Shirarete wa (if known) implies must not be known by others.,『知られては困る』=不宜被别人知道。,『知られては困る』=不宜為他人所知。,『〜ては(いけない)』の構文。,«知られては» = ne doit pas être connu.,«知られては» = tidak boleh diketahui.,«知られては» = no debe conocerse.,«知られては» = ไม่ควรถูกคนอื่นรู้,«知られては» = không nên để lộ.,,
仕事は、決められた時間内に、いかに成果を上げるかが大切であり、単に時間をかけて（ ）と私は思う。,がんばることだといってもおかしくない,がんばることでしかない,がんばりようがない,がんばればいいというものではない,がんばればいいというものではない,,,量より質。『〜というものではない』=必ずしもそうではない。,Not merely effort; form denies simplistic view.,不只是努力即可：『…というものではない』=并非如此简单。,不僅努力即可：『…というものではない』。,『〜というものではない』で一般論を否定。,Tour «〜というものではない»: pas si simple.,Bukan sekadar berusaha; bukan selalu begitu.,No basta con esforzarse; no siempre así.,ไม่ใช่แค่พยายามก็พอ รูปปฏิเสธทั่วไป,Không phải chỉ cần cố gắng là đủ.,,
現在、潜水調査船を用いた調査研究が進展中であり、いずれ近いうちに海底のより詳細な地質構造が明らかに（ ） 。,なるものと思われる,するという思いがある,なったかに思える,するだろうと思う,なるものと思われる,,,客観的な推量/見通し。『〜ものと思われる』で丁寧に予測。,Objective conjecture: 'is thought likely to'.,客观推测：『…ものと思われる』。,客觀推測：『…ものと思われる』。,丁寧な推量表現。,Forme de conjecture polie.,Ungkapan dugaan sopan.,Expresión de conjetura formal.,สำนวนคาดคะเนแบบสุภาพ,Cách diễn đạt suy đoán lịch sự.,,
山下「あのう、西村先輩。私、今日でこのサークルを（ ） 。」西村「ええ？ 辞める？ 急にどうして？」,辞めてしまわれたのでしょうか,辞めてしまったのかと思っ,辞めさせたらどうでしょうか,辞めさせてもらおうかと思って,辞めさせてもらおうかと思って,,,自分が辞める許可をもらう意図=『辞めさせてもらう』が自然。,Asking permission nuance for quitting oneself fits this pattern.,表达请求允许自己退出=『辞めさせてもらう』。,表示請求允許自己退出。,自分に対する使役+もらうの慣用。,Tournure idiomatique pour quitter avec permission.,Bentuk idiomatik untuk minta izin berhenti.,Giro idiomático para pedir permiso de dejarlo.,รูปขออนุญาตลาออกด้วย «〜させてもらう»,Cách nói xin phép nghỉ: «〜させてもらう».,,
次の文の ★ に入る最もよいものを、一つ選びなさい。「アセビ」という、白い花を咲かせる樹木を漢字で「馬酔木」と書くのは、アセビには ★ __ __ __ そうです。,由来する,有毒成分があり,状態になることに,馬が食べると酔ったような,有毒成分があり,,,『有毒成分があり→馬が食べると酔ったような→状態になることに→由来する』の意味関係。,Order shows cause: toxic → horse seems drunk → thus named.,顺序体现因果：有毒→马像醉→因此得名。,順序體現因果：有毒→馬像醉→因此而來。,因果の並びで語がつながる。,Ordre causal logique.,Urutan sebab-akibat yang logis.,Orden causal lógico.,เรียงตามเหตุผล-ผลลัพธ์,Trật tự nhân-quả hợp lý.,,
家族の時間を大切にする夫は、つい __ __ ★ __ ありがたい存在です。,大切なものは何なのか,私に,仕事に夢中になりすぎる,気づかせてくれる,本当に大切なものは何なのか,,,『本当に大切なものは何なのか→私に→気づかせてくれる→ありがたい』の流れ。,Flow: makes me realize what truly matters → grateful.,使我意识到真正重要的→让我→因此感激。,讓我意識到真正重要的→使我→因此感激。,気づかせてくれる対象=私。,Cible «私» de 気づかせてくれる.,Target «私» dari 気づかせてくれる.,Objetivo «私» de 気づかせてくれる.,ลำดับให้ฉันตระหนัก→น่าขอบคุณ,Trình tự: làm tôi nhận ra → đáng quý.,,
Ｚ県知事の林和夫氏は、週刊誌で、脱税を行った __ __ ★ __異なり、名誉を傷つけられたとして、発行元のＸ社を相手取り訴訟を起こした。,事実とは全く,疑いがあるなどと,報じられた,ことに対し,ことに対し,,,『事実とは全く→異なり』を受け『…と報じられた→ことに対し』で訴訟。,Structure: reported allegation differs from facts → sued.,结构：报道与事实完全不同→提诉。,結構：報導與事實全異→提訴。,『ことに対し』で行為の対象を示す。,Marque l'objet de l'action: ことに対し.,Menandai objek tindakan: ことに対し.,Marca el objeto de la acción: ことに対し.,ใช้ «ことに対し» ชี้เป้าการกระทำ,Dùng «ことに対し» chỉ đối tượng hành động.,,
Ｑ鉄道が１０年ぶりに運賃値上げに踏み切った。安全対策や原油の高騰で支出が増え、経営努力だけでは対応しきれないと判断 __ __ ★ __。,という,の,ことだ,して,ことだ,,,『…と判断→した→ことだ』で伝聞のまとめ。,Report style: judged thus → therefore (ことだ).,报道体：判断→した→ことだ。,報導體：判斷→した→ことだ。,『ことだ』で説明の結語。,«ことだ» conclut l'explication.,«ことだ» menutup penjelasan.,«ことだ» cierra la explicación.,«ことだ» ปิดท้ายคำอธิบาย,«ことだ» kết câu giải thích.,,
世の中にはさまざまな資格があふれているが、資格を取った __ __ __ ★ 世間は甘くないらしい。,だけ,ほど,で,希望の職につける,ほど,,,『資格を取った→だけ/ほど/で→希望の職につける→ほど』の対比で『世間は甘くない』を示す。,Shows contrast: merely getting certificates doesn't ensure jobs.,对比：仅拿证并不保证理想工作。,對比：只拿證不保證理想工作。,『〜だけで〜ほど』の構文で安易さ否定。,Contraste: pas si simple avec un diplôme.,Kontras: sertifikat saja tak cukup.,Contraste: no basta con un título.,ตอกย้ำว่า แค่มีใบรับรองไม่พอ,Nhấn mạnh: chỉ có chứng chỉ là chưa đủ.,,
,こちらにはいえないこともない,こちらにいえるとは限らない,こちらにもいえるとは思わなかった,こちらにはいえないと思うのか,こちらにいえるとは限らない,JlptN1ReadingImgae1,,一般論がすべてに当てはまるとは限らない、という趣旨。,Point: not everything generalizable.,要点：一般论未必处处适用。,要點：一般論は必ずしも当てはまらない。,一般化の否定。,Nuance: pas toujours généralisable.,Inti: tidak selalu berlaku umum.,Idea: no siempre generalizable.,ใจความ: ใช้ทั่วไปไม่ได้เสมอ,Ý: không phải lúc nào cũng áp dụng.,P1,41の中に入る最もよいものを、一つ選びなさい。
,そういう,する,あの,やろうという,そういう,JlptN1ReadingImgae1,,前に述べた内容を受ける『そういう』が自然。,Refers back with 'that kind'.,指代前文用『そういう』自然。,承前『そういう』が自然。,指示語の整合。,Cohérence du démonstratif.,Kohesi penunjuk yang tepat.,Coherencia del demostrativo.,คำชี้เฉพาะสอดคล้องบริบท,Từ chỉ thị phù hợp ngữ cảnh.,P1,42の中に入る最もよいものを、一つ選びなさい。
,トイレのことだ,トイレのことであるに違いない,トイレだからである,トイレだと聞いている,トイレのことだ,JlptN1ReadingImgae1,,文脈上、指しているのは『トイレのこと』。断定が自然。,Context points to toilet; plain statement fits.,语境指的是『厕所』，直述自然。,文脈はトイレのこと。,指示対象の明確化。,Clarifie la référence (toilettes).,Menjelaskan rujukan (toilet).,Aclara la referencia (baño).,ชี้ชัดสิ่งที่อ้างถึง (ห้องน้ำ),Làm rõ đối tượng được nói đến.,P1,43の中に入る最もよいものを、一つ選びなさい。
,もっともである,当然である,ところがである,例えばである,ところがである,JlptN1ReadingImgae1,,逆接の展開に『ところが』が最適。,Contrast requires 'however'.,转折关系用『ところが』最合适。,轉折關係用『ところが』。,逆接の接続詞。,Conjonction adversative.,Konjungsi pertentangan.,Conjunción adversativa.,สันธานแสดงความขัดแย้ง,Liên từ nghịch chuyển.,P1,44の中に入る最もよいものを、一つ選びなさい。
,認識させられたことがある,認識させられたおかげだ,認識させられる話があった,認識させられる出来事だった,認識させられる出来事だった,JlptN1ReadingImgae1,,出来事を通じて『認識させられる出来事だった』が最も自然。,Most natural: it was an event that made one realize.,最自然：『让人认识到的事件』。,最自然：『讓人認識到的事件』。,経験→認識という流れ。,Expérience → prise de conscience.,Pengalaman → menyadari.,Experiencia → toma de conciencia.,ประสบการณ์ → ตระหนักรู้,Trải nghiệm → nhận thức.,P1,45の中に入る最もよいものを、一つ選びなさい。
筆者の考えに合うのはどれか。,教師と生徒が自由に発言し合うことも必要だ。,教師は生徒の考えを想像するべきだ。,教師は生徒の発言を待つことも必要だ。,教師は生徒に沈黙の時間を与えないようにすべきだ。,教師は生徒の発言を待つことも必要だ。,JlptN1ReadingImgae2,,筆者は教師が生徒の発言を待つことも必要とし、自由な対話を促すことが大事と考える。,The author believes teachers should also wait for student input to foster dialogue.,作者认为教师应等待学生发言，促进自由对话。,作者認為教師應等學生發言，促進對話。,筆者は教師が生徒の発言を待つことも重視する。,L'auteur estime que les enseignants doivent attendre les interventions des élèves.,Penulis menganggap guru perlu menunggu siswa berbicara.,El autor cree que los profesores deben esperar a que hablen los estudiantes.,ผู้เขียนเห็นว่าครูควรรอให้นักเรียนพูด,Tác giả cho rằng giáo viên nên chờ học sinh phát biểu。,,
市民運動場の予約について、このお知らせは何を知らせているか。,管理事務所窓口での予約受付期間が変更になること,管理事務所窓口で利用者登録をすれば、インターネット上で予約ができるようになること,インターネット上での予約受付時間がこれまでより長くなること,インターネット上の予約システムの導入により、管理事務所窓口での予約ができなくなること。,管理事務所窓口で利用者登録をすれば、インターネット上で予約ができるようになること,JlptN1ReadingImgae3,,お知らせは窓口利用者登録でインターネット予約が可能になることを伝えている。,The notice informs that internet reservations become available after registering at the office.,通知说明办理窗口注册后可网上预约。,通知說明登記後可網路預約。,窓口登録でネット予約可能と案内。,"L'avis informe qu'après inscription, réservation en ligne possible.",Pemberitahuan menyatakan pendaftaran di kantor memungkinkan reservasi online.,El aviso indica que tras registro se puede reservar por internet.,แจ้งว่าสามารถจองออนไลน์ได้หลังลงทะเบียนที่สำนักงาน,Thông báo cho biết đăng ký tại quầy sẽ có thể đặt lịch qua mạng。,,
筆者によると、異文化間で対話を通して人間関係を築く上で最も大切なことは何か。,自己の価値観を理解してもらおうとする態度,自己の価値観を保ちながら、他者の価値観を理解する態度,他者と自己の共通の価値観を創り上げていく態度,他者の価値観の中に自己を合わせる態度,他者と自己の共通の価値観を創り上げていく態度,JlptN1ReadingImgae4,,著者は対話で共通の価値観を創造する態度が異文化理解に重要とする。,The author values creating shared values through dialogue in cross-cultural relations.,作者重视通过对话创造共同价值观。,作者重視透過對話創造共同價值觀。,共通の価値観を築くことが重要。,L'auteur valorise la création de valeurs communes par le dialogue.,Penulis menilai pentingnya membangun nilai bersama.,El autor valora crear valores compartidos.,ผู้เขียนเน้นการสร้างคุณค่าร่วมผ่านการสนทนา,Tác giả nhấn mạnh xây dựng giá trị chung qua đối thoại。,,
この文章で筆者が述べていることは何か。,「普通」という視点がないと、「特別なもの」は作れない。,「普通の人」が普通のものを作ると、「特別なもの」になる。,「変な人」が普通のものを作ると、「特別なもの」になる。,「変な人」の視点でしか、「特別なもの」は作れない。,「普通」という視点がないと、「特別なもの」は作れない。,JlptN1ReadingImgae5,,筆者は普通を理解しないと特別なものは生まれないと述べる。,"The author says without understanding 'normal', you can't create 'special'.",作者说没有‘普通’的视角无法创造‘特别’。,作者說沒有「普通」的視角，無法創造「特別」。,『普通』の理解なしに『特別』は生まれない。,"L'auteur dit que sans «normal», pas de «spécial».",Penulis mengatakan tanpa memahami 'biasa' tak bisa buat 'istimewa'.,El autor dice que sin entender 'normal' no se puede crear 'especial'.,ผู้เขียนกล่าวว่าไม่มี 'ปกติ' ก็ไร้ 'พิเศษ',Tác giả nói không hiểu 'bình thường' thì không tạo được 'đặc biệt'.,,
,犬ではなくオオカミを飼おうとしたこと,オオカミを肉食獣だと思わなかったこと,恐ろしいオオカミを飼って利用しようと考えたこと,狩りの邪魔になるのに恐ろしいオオカミを飼おうとしたこと,恐ろしいオオカミを飼って利用しようと考えたこと,JlptN1ReadingImgae6,,筆者は恐ろしいオオカミを飼い利用しようと考えたことが謎と述べる。,The author notes it is puzzling they tried to keep and use a fearsome wolf.,作者指出饲养恐怖狼及利用是谜。,作者指出飼養恐怖狼並試圖利用是謎。,恐ろしいオオカミを飼うことが謎。,L'auteur trouve étrange d'élever un loup effrayant.,Penulis bingung mengapa memelihara serigala menakutkan.,El autor considera un misterio criar lobos temibles.,ผู้เขียนสงสัยการเลี้ยงหมาป่ากลัว,Tác giả thấy lạ khi nuôi sói hung dữ。,P2,謎が多いとあるが、謎に合うのはどれか。
,群れから追い出されたオオカミ,狩りの上手なオオカミ,群れの中で下位のオオカミ,人間に近づいたオオカミ,群れの中で下位のオオカミ,JlptN1ReadingImgae6,,筆者は群れの中で下位のオオカミを犬の祖先と考える。,The author considers subordinate wolves in a pack as dog's ancestors.,作者认为群中低位狼是犬的祖先。,作者認為群體中地位較低的狼是犬的祖先。,群れの下位のオオカミが祖先。,L'auteur considère les loups subordonnés comme ancêtres.,Penulis anggap serigala bawahan nenek moyang anjing.,El autor cree que lobos subordinados son ancestros.,ผู้เขียนว่าเป็นหมาป่าต่ำต้อยในฝูง,Tác giả cho rằng sói cấp dưới là tổ tiên chó。,P2,筆者によると、どのようなオオカミが犬の祖先だと考えられるか。