question,option1,option2,option3,option4,answer,audioFileName,startTime,endTime,imageName,scriptKey,script_ko,script_en,script_zh_hans,script_zh_hant,script_ja,script_fr,script_id,script_es,script_th,script_vi
6番,1,2,3,4,3,n1q48.m4a,589,692,,,"6번 내레이터: 호텔의 경영 회의에서 여자가 경영 개선에 대해 이야기하고 있습니다. 여: 숙박객이 감소하여 실적이 악화되고 있는 지금, 경영 개선이 필요합니다. 그래서 제안하고 싶은 것이, 호텔 내에 있는 직영 레스토랑의 재검토입니다. 이 레스토랑은 조식 시간 외에는 이용하는 손님이 거의 없어 유지비만 들고 경영에 부담이 되고 있습니다. 레스토랑 리모델링 등을 통한 고객 증가를 기대하기보다는, 외식 전문 업체와 제휴하여 경비를 절감하는 편이 상책이라고 생각합니다. 예를 들어 1층 레스토랑을 패밀리 레스토랑에 위탁하고, 숙박객에게는 조식 쿠폰을 지급하여 그곳을 이용하게 하는 것은 어떨까요? 이렇게 하면 직영 레스토랑이 없어도 서비스 저하는 발생하지 않으며, 위탁 업체 입장에서도 호텔 이용객이 확실하게 자신의 가게 손님이 되므로 양쪽 모두에게 메리트가 있다고 할 수 있습니다. 내레이터: 여자는 무엇을 제안하고 있습니까? 레스토랑 리모델링 직영 레스토랑 설치 외식 전문 업체로의 업무 위탁 숙박객에 대한 서비스 개선","Narrator: No. 6. At a hotel management meeting, a woman is talking about improving management. Woman: With the number of guests decreasing and our business performance slumping, management improvement is necessary. Therefore, I'd like to propose reviewing the directly managed restaurant inside the hotel. This restaurant has almost no customers outside of breakfast hours, consuming maintenance costs and becoming a burden on management. Rather than hoping for an increase in customers through restaurant renovations or the like, I believe it's a better strategy to partner with a specialized food and beverage company to cut costs. For example, how about outsourcing the 1st-floor restaurant to a family restaurant chain and giving hotel guests breakfast coupons to use there? By doing this, service quality won't decline even without a directly managed restaurant, and the outsourced company will reliably get the hotel's guests as their own customers, meaning it has merits for both sides. Narrator: What is the woman proposing? Restaurant renovation / Establishing a directly managed restaurant / Outsourcing operations to a specialized food and beverage company / Improving services for hotel guests.",旁白：6号。在酒店的经营会议上，女人正在谈论关于改善经营的问题。 女：在住宿客人减少、业绩下滑的现在，改善经营是必须的。因此我想提议的是，重新评估酒店内的直营餐厅。这家餐厅除了早餐时间以外，几乎没有客人使用，光是消耗维护费，已经成为了经营的负担。与其期待通过餐厅翻新等方式来增加客流，我认为不如与专业的餐饮公司合作，削减开支才是上策。例如，把一楼的餐厅委托给家庭餐厅经营，给住宿客人发放早餐券让他们去那里用餐，大家觉得怎么样？这样做的话，即使没有直营餐厅也不会导致服务质量下降，而对于承包方来说，酒店的客人会切实地成为他们店里的客人，可以说是对双方都有利。 旁白：女人提议了什么？ 翻新餐厅 / 设立直营餐厅 / 将业务外包给专业的餐饮公司 / 改善对住宿客人的服务,旁白：6號。在酒店的經營會議上，女人正在談論關於改善經營的問題。 女：在住宿客人減少、業績下滑的現在，改善經營是必須的。因此我想提議的是，重新評估酒店內的直營餐廳。這家餐廳除了早餐時間以外，幾乎沒有客人使用，光是消耗維護費，已經成為了經營的負擔。與其期待透過餐廳翻新等方式來增加客流量，我認為不如與專業的餐飲公司合作，削減開支才是上策。例如，把一樓的餐廳委託給家庭餐廳經營，給住宿客人發放早餐券讓他們去那裡用餐，大家覺得怎麼樣？這樣做的話，即使沒有直營餐廳也不會導致服務品質下降，而對於承包方來說，酒店的客人會切實地成為他們店裡的客人，可以說是對雙方都有利。 旁白：女人提議了什麼？ 翻新餐廳 / 設立直營餐廳 / 將業務外包給專業的餐飲公司 / 改善對住宿客人的服務,6番 ナレーター：ホテルの経営会議で、女の人が経営の改善について話しています。 女：宿泊客が減少し、業績が落ち込んでいる今、経営の改善が必要です。そこで提案したいのが、ホテル内にある直営レストランの見直しです。このレストランは、朝食時以外はほとんど客の利用がなく、維持費ばかりかかり、経営の負担になっております。レストラン改装などによる客の増加に期待するよりも、飲食専門の会社と提携し、経費を抑える方が得策だと考えます。例えば1階のレストランをファミリーレストランに委託し、宿泊客には朝食クーポンを渡してそこを利用してもらうというのはどうでしょうか。これなら直営レストランがなくてもサービスの低下にはなりませんし、委託先にとってもホテルの利用客が確実に自分の店の客になるので、双方にメリットがあると言えます。 ナレーター：女の人は何を提案していますか。  レストランの改装  直営レストランの設置  飲食専門の会社への業務委託  宿泊客へのサービスの改善,"Narrateur : Numéro 6. Lors d'une réunion de direction d'un hôtel, une femme parle de l'amélioration de la gestion. Femme : Avec la baisse de la fréquentation et la chute de nos résultats, il est nécessaire d'améliorer notre gestion. C'est pourquoi je voudrais proposer de revoir le restaurant géré directement au sein de l'hôtel. À l'exception de l'heure du petit-déjeuner, ce restaurant n'accueille presque aucun client ; il ne génère que des frais d'entretien et pèse sur nos finances. Plutôt que d'espérer une augmentation du nombre de clients en rénovant le restaurant, je pense qu'il est préférable de s'associer à une entreprise spécialisée dans la restauration pour réduire nos frais. Par exemple, que diriez-vous de confier le restaurant du premier étage à une chaîne de restauration familiale et de distribuer des coupons de petit-déjeuner aux clients de l'hôtel pour qu'ils l'utilisent ? De cette façon, même sans restaurant en gestion directe, la qualité du service ne baissera pas, et pour le prestataire, les clients de l'hôtel deviendront à coup sûr des clients de son établissement. On peut donc dire qu'il y a des avantages pour les deux parties. Narrateur : Que propose la femme ? La rénovation du restaurant / La création d'un restaurant en gestion directe / L'externalisation à une entreprise spécialisée dans la restauration / L'amélioration des services pour les clients de l'hôtel.","Narator: Nomor 6. Pada rapat manajemen hotel, seorang wanita berbicara tentang perbaikan manajemen. Wanita: Di saat jumlah tamu menginap menurun dan kinerja bisnis merosot seperti sekarang, perbaikan manajemen sangat diperlukan. Oleh karena itu, saya ingin mengusulkan untuk meninjau ulang restoran yang dikelola langsung di dalam hotel. Restoran ini hampir tidak ada pelanggan di luar jam sarapan, hanya menghabiskan biaya pemeliharaan, dan menjadi beban bagi manajemen. Daripada berharap pada peningkatan pelanggan melalui renovasi restoran dan semacamnya, saya pikir lebih baik bermitra dengan perusahaan khusus makanan dan minuman untuk memangkas biaya. Misalnya, bagaimana kalau kita menyerahkan restoran lantai 1 ke jaringan restoran keluarga, dan memberikan kupon sarapan kepada tamu hotel untuk digunakan di sana? Dengan begini, meskipun tidak ada restoran yang dikelola langsung, kualitas layanan tidak akan menurun, dan bagi pihak yang dititipkan, pelanggan hotel pasti akan menjadi pelanggan tokonya, sehingga bisa dikatakan ada keuntungan bagi kedua belah pihak. Narator: Apa yang diusulkan oleh wanita tersebut? Renovasi restoran / Pendirian restoran yang dikelola langsung / Penyerahan operasi ke perusahaan khusus makanan dan minuman / Peningkatan layanan untuk tamu yang menginap.","Narrador: Número 6. En una reunión de dirección de un hotel, una mujer habla sobre la mejora de la gestión. Mujer: Ante la disminución del número de huéspedes y la caída del rendimiento de nuestro negocio, es necesaria una mejora de la gestión. Por lo tanto, me gustaría proponer que revisemos el restaurante gestionado directamente dentro del hotel. Este restaurante casi no tiene clientes fuera del horario del desayuno, consume gastos de mantenimiento y se está convirtiendo en una carga para la dirección. En lugar de esperar un aumento de clientes mediante la renovación del restaurante o similares, creo que es mejor estrategia asociarse con una empresa especializada en alimentación y bebidas para recortar gastos. Por ejemplo, ¿qué tal si subcontratamos el restaurante del primer piso a una cadena de restaurantes familiares y entregamos a los huéspedes del hotel cupones de desayuno para que los usen allí? De este modo, la calidad del servicio no decaerá aunque no haya un restaurante gestionado directamente, y la empresa subcontratada conseguirá de forma segura a los huéspedes del hotel como clientes propios, lo que significa que tiene ventajas para ambas partes. Narrador: ¿Qué propone la mujer? Renovación del restaurante / Creación de un restaurante de gestión directa / Subcontratación de las operaciones a una empresa especializada en alimentación y bebidas / Mejora de los servicios para los huéspedes del hotel.",ผู้บรรยาย: ข้อ 6 ในการประชุมผู้บริหารโรงแรม ผู้หญิงคนหนึ่งกำลังพูดคุยเกี่ยวกับการปรับปรุงการบริหาร หญิง: ในขณะที่จำนวนแขกเข้าพักลดลงและผลประกอบการทางธุรกิจกำลังตกต่ำ การปรับปรุงการบริหารเป็นสิ่งจำเป็นค่ะ ดังนั้น สิ่งที่ฉันอยากจะเสนอคือ การทบทวนเรื่องร้านอาหารที่บริหารงานโดยตรงภายในโรงแรมค่ะ ร้านอาหารแห่งนี้แทบจะไม่มีลูกค้ามาใช้บริการเลยนอกเหนือจากเวลาอาหารเช้า ทำให้ต้องสิ้นเปลืองค่าบำรุงรักษาและกลายเป็นภาระในการบริหารงาน แทนที่จะหวังว่าจำนวนลูกค้าจะเพิ่มขึ้นจากการปรับปรุงร้านอาหารใหม่ ฉันคิดว่ามันน่าจะเป็นแผนที่ดีกว่าหากเราจะร่วมมือกับบริษัทที่เชี่ยวชาญด้านอาหารและเครื่องดื่มเพื่อลดค่าใช้จ่ายค่ะ ยกตัวอย่างเช่น จะเป็นอย่างไรถ้าเรามอบหมายร้านอาหารชั้น 1 ให้เป็นแฟรนไชส์ร้านอาหารสำหรับครอบครัวดูแล และแจกคูปองอาหารเช้าให้แขกที่มาพักเพื่อไปใช้บริการที่นั่น? หากทำแบบนี้ แม้จะไม่มีร้านอาหารที่บริหารเอง คุณภาพการบริการก็จะไม่ลดลง และสำหรับบริษัทที่รับมอบหมาย ก็จะได้รับแขกของโรงแรมไปเป็นลูกค้าของร้านอย่างแน่นอน ซึ่งถือได้ว่ามีผลประโยชน์ร่วมกันทั้งสองฝ่ายค่ะ ผู้บรรยาย: ผู้หญิงคนนี้กำลังเสนอเรื่องอะไร? การปรับปรุงร้านอาหารใหม่ / การก่อตั้งร้านอาหารที่บริหารงานโดยตรง / การมอบหมายงานให้กับบริษัทที่เชี่ยวชาญด้านอาหารและเครื่องดื่ม / การปรับปรุงบริการสำหรับแขกที่เข้าพักโรงแรม,"Người dẫn chuyện: Câu 6. Tại cuộc họp ban quản lý của một khách sạn, một người phụ nữ đang nói về việc cải thiện kinh doanh. Nữ: Trong tình hình lượng khách lưu trú giảm sút và thành tích kinh doanh đang đi xuống như hiện nay, việc cải thiện hoạt động kinh doanh là điều cần thiết. Vì vậy, tôi muốn đề xuất việc xem xét lại nhà hàng do khách sạn trực tiếp điều hành nằm bên trong khuôn viên. Nhà hàng này hầu như không có khách sử dụng ngoài giờ ăn sáng, chỉ tiêu tốn chi phí bảo trì và đang trở thành một gánh nặng cho hoạt động kinh doanh. Thay vì kỳ vọng lượng khách sẽ tăng lên thông qua việc cải tạo lại nhà hàng, tôi cho rằng hợp tác với một công ty chuyên về dịch vụ ăn uống để cắt giảm chi phí sẽ là thượng sách. Ví dụ, nếu chúng ta ủy thác nhà hàng ở tầng 1 cho một chuỗi nhà hàng gia đình kinh doanh, và phát phiếu ăn sáng cho khách lưu trú để họ sử dụng tại đó thì mọi người thấy thế nào? Làm như vậy, dù không có nhà hàng trực tiếp điều hành thì chất lượng dịch vụ cũng không bị giảm sút, và đối với bên nhận ủy thác, khách của khách sạn chắc chắn sẽ trở thành khách hàng của cửa hàng họ, nên có thể nói là đôi bên cùng có lợi. Người dẫn chuyện: Người phụ nữ đang đề xuất điều gì? Cải tạo nhà hàng / Thành lập nhà hàng trực tiếp điều hành / Ủy thác công việc kinh doanh cho công ty chuyên về dịch vụ ăn uống / Cải thiện dịch vụ đối với khách lưu trú."
1番,1,2,3,,3,n1q49.m4a,35,59,,,"1번 아아, 너무 무모하게 구네. 어? 그거 안타깝네. 으음, 그렇지 않아. 뭐? 무슨 일이야?","No. 1. Ah, you're being so unreasonable. Eh? That's a shame. Hmm, that's not true. What? What's wrong?",1号。哎，真是胡来啊。 诶？那真遗憾啊。 嗯，没那种事。 什么？怎么了？,1號。哎，真是胡來啊。 欸？那真遺憾啊。 嗯，沒那種事。 什麼？怎麼了？,1番 あーあ、無茶苦茶する。  え？それは残念ね。  うーん、そんなことはないよ。  何？どうしたの？,"Numéro 1. Ah là là, tu agis de façon déraisonnable. Hein ? C'est dommage. Hmm, ce n'est pas le cas. Quoi ? Qu'y a-t-il ?","Nomor 1. Ah, kamu bertindak tidak masuk akal. Eh? Sayang sekali ya. Hmm, tidak juga. Apa? Ada apa?","Número 1. Ah, estás siendo muy poco razonable. ¿Eh? Qué pena. Hmm, eso no es verdad. ¿Qué? ¿Qué pasa?",ข้อ 1 โธ่เอ๊ย ทำอะไรไร้เหตุผลจังเลยนะ เอ๋? น่าเสียดายจังเลยนะ อืม ไม่ใช่อย่างนั้นหรอก อะไรนะ? เกิดอะไรขึ้นเหรอ?,"Câu 1. Ây da, làm việc vô lý quá đi mất. 1. Hả? Đáng tiếc thật đấy. 2. Ừm, không có chuyện đó đâu. 3. Cái gì? Có chuyện gì vậy?"
2番,1,2,3,,1,n1q49.m4a,63,90,,,"2번 죄송합니다. 극장 내에서의 음식 섭취는 삼가 주시겠습니까? 아, 네. 죄송합니다. 네, 드세요. 사양 마시고요. 극장 안이라면 괜찮다는 거군요.","No. 2. Excuse me. Could you please refrain from eating and drinking inside the theater? Ah, yes. I'm sorry. Yes, please go ahead. Don't hesitate. So it's fine as long as I'm inside the theater, right?",2号。不好意思。请问能不在剧场内饮食吗？ 啊，好的。对不起。 好的，请。别客气。 只要在剧场里就可以是吧。,2號。不好意思。請問能不在劇場內飲食嗎？ 啊，好的。對不起。 好的，請。別客氣。 只要在劇場裡就可以是吧。,2番 恐れ入ります。劇場内でのご飲食はお控えいただけますか。  あ、はい。すみません。  ええ、どうぞ。ご遠慮なく。  劇場の中ならいいんですね。,"Numéro 2. Excusez-moi. Pourriez-vous vous abstenir de manger et de boire à l'intérieur du théâtre ? Ah, oui. Excusez-moi. Oui, allez-y. N'hésitez pas. Donc c'est bon si c'est à l'intérieur du théâtre.","Nomor 2. Permisi. Bisakah Anda menahan diri untuk tidak makan dan minum di dalam teater? Ah, ya. Maaf. Ya, silakan. Jangan sungkan. Jadi tidak apa-apa asalkan di dalam teater, ya.","Número 2. Disculpe. ¿Podría abstenerse de comer y beber dentro del teatro? Ah, sí. Lo siento. Sí, por favor, adelante. No lo dude. Entonces no hay problema siempre que esté dentro del teatro, ¿verdad?",ข้อ 2 ขอโทษนะครับ กรุณางดรับประทานอาหารและเครื่องดื่มภายในโรงละครได้ไหมครับ? อ๊ะ ค่ะ ขอโทษทีค่ะ เชิญตามสบายเลยค่ะ ไม่ต้องเกรงใจ งั้นถ้าอยู่ในโรงละครก็ไม่เป็นไรสินะคะ,"Câu 2. Xin lỗi quý khách. Quý khách có thể vui lòng không ăn uống trong rạp hát được không ạ? 1. À, vâng. Xin lỗi. 2. Vâng, xin mời. Cứ tự nhiên. 3. Vậy là chỉ cần ở trong rạp là được đúng không."
3番,1,2,3,,3,n1q49.m4a,97,125,,,"3번 또 휴일 출근이라니 말도 안 되지. 정말, 농담도 적당히 해. 진짜, 쉬는 날이라 다행이야. 아아, 약속 취소해야겠네.","No. 3. Working on a holiday again, this must be a joke. Jeez, keep the jokes in moderation. Really, I'm glad it's a day off. Ah, I'll have to cancel my plans.",3号。又是节假日加班，开什么玩笑啊。 真是的，开玩笑也要适可而止啊。 真的，放假真是太好了。 唉，得把预约取消了。,3號。又是假日加班，開什麼玩笑啊。 真是的，開玩笑也要適可而止啊。 真的，放假真是太好了。 唉，得把預約取消了。,3番 また休日出勤なんて冗談じゃないよね。  もう、冗談もほどほどにね。  ほんと、休みでよかった。  ああ、約束キャンセルしなくちゃ。,"Numéro 3. Encore travailler un jour férié, c'est une blague. Allez, les blagues, ça va un moment. Vraiment, heureusement que c'est un jour de congé. Ah, il va falloir que j'annule mon rendez-vous.","Nomor 3. Bekerja di hari libur lagi, ini pasti bercanda. Ya ampun, bercandanya jangan kelewatan. Sungguh, syukurlah ini hari libur. Ah, aku harus membatalkan janjiku.","Número 3. Trabajando en un día festivo otra vez, esto debe ser una broma. Vaya, guarda las bromas con moderación. La verdad, me alegro de que sea un día libre. Ah, tendré que cancelar mis planes.",ข้อ 3 ต้องมาทำงานในวันหยุดอีกแล้ว ล้อเล่นหรือเปล่าเนี่ย โธ่ ล้อเล่นก็ให้มันมีขอบเขตหน่อยเถอะ ดีจริงๆ ที่เป็นวันหยุด อ๊า ต้องไปยกเลิกนัดซะแล้ว,"Câu 3. Lại đi làm vào ngày nghỉ, đùa nhau chắc. 1. Thôi nào, đùa thì cũng vừa phải thôi. 2. Thật sự, may mà là ngày nghỉ. 3. Á, tôi phải hủy cuộc hẹn mất rồi."
4番,1,2,3,,1,n1q49.m4a,129,157,,,"4번 다나카 부장님, 이번 프로젝트 건으로 부장님의 의견을 들려주셨으면 하는데요. 응, 괜찮아. 뭔데? 아직 아무 말도 안 했어. 꼭 들려줬으면 좋겠네.","No. 4. Department Manager Tanaka, regarding the upcoming project, I was hoping to get your opinion. Yeah, I don't mind. What is it? I haven't said anything yet. I definitely want to hear it.",4号。田中部长，关于这次的项目，想请田中部长给点意见。 嗯，可以啊。什么事？ 我还什么都没说呢。 务必请你让我听听。,4號。田中部長，關於這次的專案，想請田中部長給點意見。 嗯，可以啊。什麼事？ 我還什麼都沒說呢。 務必請你讓我聽聽。,4番 田中部長、今度のプロジェクトのことで、田中部長にご意見をいただけたらと思うんですが。  うん、構わないよ。何？  まだ何も言ってないよ。  ぜひ聞かせてほしいな。,"Numéro 4. Monsieur le Directeur Tanaka, concernant le prochain projet, j'aurais aimé avoir votre avis. Oui, pas de problème. Qu'est-ce que c'est ? Je n'ai encore rien dit. J'aimerais beaucoup l'entendre.","Nomor 4. Manajer Departemen Tanaka, mengenai proyek mendatang, saya ingin meminta pendapat Manajer Tanaka. Ya, tidak masalah. Ada apa? Saya belum bilang apa-apa lho. Saya pasti ingin mendengarnya.","Número 4. Director de Departamento Tanaka, sobre el próximo proyecto, me gustaría conocer su opinión. Sí, no me importa. ¿Qué pasa? Todavía no he dicho nada. Definitivamente quiero escucharla.",ข้อ 4 ผู้จัดการแผนกทานากะคะ เกี่ยวกับโปรเจกต์ครั้งหน้า ฉันอยากจะขอความคิดเห็นจากผู้จัดการทานากะสักหน่อยค่ะ อืม ไม่รังเกียจหรอก ว่าไงล่ะ? ยังไม่ได้พูดอะไรเลยนะ อยากจะฟังให้ได้เลยล่ะ,"Câu 4. Trưởng phòng Tanaka, về dự án sắp tới, tôi muốn xin ý kiến của Trưởng phòng ạ. 1. Ừ, không sao đâu. Chuyện gì vậy? 2. Tôi vẫn chưa nói gì mà. 3. Nhất định hãy cho tôi nghe nhé."
